{
  "schema_version": "melissa.container-exec/v1",
  "image_id": "sha256:b8b264f0d1c889fe9510197a0b16a85d06685b2d112bb4115f7b33072ce46ec4",
  "executable": "/bin/sh",
  "argv": ["-c", "printf 'reviewed fixture'"] ,
  "cwd": ".",
  "env": {},
  "limits": {
    "wall_time_ms": 5000,
    "cpu_time_ms": 3000,
    "cpu_rate_basis_points": 10000,
    "memory_bytes": 134217728,
    "disk_bytes": 33554432,
    "output_bytes": 65536,
    "max_processes": 16,
    "export_bytes": 1048576
  }
}
